ORDER	SENTENCE	STATUS	WORD	RANK	COUNT	COUNT_REL	INDEX	ID
198	گفت مردم ایران و جهان را با آب..	Y	مردم	40	  138,252	0.1915	58.125	persian_news_2016_00741987
199	این یک حق است که مردم باید از آن استفاده کنند.	Y	مردم	40	  138,252	0.1915	58.6364	persian_news_2017_00159155
200	مردم بوده است که هنوز به این.	Y	مردم	40	  138,252	0.1915	59	persian_news_2019_00779318
201	داده شده بود اشاره کرده و گفت.	Y	کرده	41	  137,897	0.191	40.7143	persian_news_2019_00422445
202	کرده اند تا نظام جمهوری اسلامی را با.	Y	کرده	41	  137,897	0.191	60.25	persian_news_2019_00697930
203	مردم ایران در هر صورت راه خود را انتخاب کرده است.	Y	کرده	41	  137,897	0.191	60.5455	persian_news_2019_00778865
204	کرده و از حمایت کنند و ما در این.	Y	کرده	41	  137,897	0.191	63.75	persian_news_2019_00698040
205	ای را در مورد برنامه ایران مطرح کرده باشد.	Y	کرده	41	  137,897	0.191	66.5556	persian_news_2019_00031545
206	به هر دو اشاره ای خواهد شد.	Y	دو	42	  134,806	0.1867	46.4286	persian_news_2016_00359095
207	آنها نیز آغاز شده است او گفت دو هزار.	Y	دو	42	  134,806	0.1867	47.3333	persian_news_2019_00165060
208	دو کشور ایران و عراق صورت گرفته است.	Y	دو	42	  134,806	0.1867	55.25	persian_news_2019_00507043
209	اجرای این حدود دو ماه ادامه دارد و در..	Y	دو	42	  134,806	0.1867	67.1111	persian_news_2016_00021681
210	پیش از این هر دو یک بار برگزار می..	Y	دو	42	  134,806	0.1867	69.8889	persian_news_2017_00380882
211	است او گفت 45 درصد از این به شهرستان..	Y	او	43	  126,978	0.1759	43	persian_news_2016_00060889
212	او افزود در بخش هستند که با توجه به اینکه.	Y	او	43	  126,978	0.1759	51.5	persian_news_2019_00170372
213	 های این کار را به او می.	Y	او	43	  126,978	0.1759	59.625	persian_news_2019_00014123
214	یک در این شهرستان با خبر شدند او افزود.	Y	او	43	  126,978	0.1759	66.3333	persian_news_2019_00695756
215	اینکه وزارت دیگر او را به عنوان معاون در.	Y	او	43	  126,978	0.1759	71.2222	persian_news_2019_00153676
216	در این کشور ها چه می کند وی.	Y	کند	44	  124,443	0.1723	63.3333	persian_news_2019_00443501
217	را نیز در کشور تولید کند بیش از.	Y	کند	44	  124,443	0.1723	64.5	persian_news_2019_00516250
218	کند عضو مجلس گفت به نظر من در.	Y	کند	44	  124,443	0.1723	65.125	persian_news_2019_00710696
219	ها این بوده که باید با دولت همکاری کند..	Y	کند	44	  124,443	0.1723	67	persian_news_2017_00865376
220	کند وی پس از حضور این مراسم به تهران.	Y	کند	44	  124,443	0.1723	69.5556	persian_news_2019_00710792
221	ما با این  ها و استفاده از آنها خواهد.	Y	خواهد	45	  123,964	0.1717	60.3	persian_news_2019_00736303
222	نیز انتخابات به صورت تمام برگزار خواهد شد که..	Y	خواهد	45	  123,964	0.1717	64.3333	persian_news_2017_00847358
223	حضور دارد جدید می خواهد که همه آن ها.	Y	خواهد	45	  123,964	0.1717	65.2222	persian_news_2019_00403356
224	رئیس دانشگاه آزاد اسلامی گفت با اعلام این که ای دانشگاه به 40 درصد افزایش خواهد.	Y	خواهد	45	  123,964	0.1717	65.4286	persian_news_2019_00544320
225	و انجام خواهد شد گفت ایجاد طرح های..	Y	خواهد	45	  123,964	0.1717	66.25	persian_news_2016_00919780
226	با اشاره به گزارش مجلس شورای اسلامی گفت.	Y	گزارش	46	  121,942	0.1689	48.625	persian_news_2019_00193994
227	مصرف در کشور گزارش شده است که از این..	Y	گزارش	46	  121,942	0.1689	48.6667	persian_news_2017_00804127
228	بود وی ادامه داد گزارش بودجه 96 در..	Y	گزارش	46	  121,942	0.1689	72.4286	persian_news_2017_00363878
229	شده است وی ادامه داد این گزارش به امنیت..	Y	گزارش	46	  121,942	0.1689	74.5556	persian_news_2016_00644923
230	یک بار بررسی می کنند تهران افزود این گزارش..	Y	گزارش	46	  121,942	0.1689	76.1111	persian_news_2016_00720917
231	مورد در سال 2016 انجام شده که استفاده از.	Y	مورد	47	  115,492	0.1599	34.25	persian_news_2019_00823922
232	و در مورد روزنامه «ایران» به چه صورت است؟	Y	مورد	47	  115,492	0.1599	49.7778	persian_news_2016_00949100
233	در ادامه هر سه مورد بررسی خواهد شد.	Y	مورد	47	  115,492	0.1599	66.75	persian_news_2019_00434380
234	برگزار شد که تعداد آن نیز 20 مورد بود.	Y	مورد	47	  115,492	0.1599	70	persian_news_2019_00245099
235	دولت و در این مورد در مرکز توجه.	Y	مورد	47	  115,492	0.1599	71.7143	persian_news_2019_00509786
236	به هر حال کار در حال انجام است.	Y	هر	48	  114,694	0.1588	39	persian_news_2016_00358831
237	استان باید برنامه های برای سال 1398 را هر.	Y	هر	48	  114,694	0.1588	43.5	persian_news_2019_00059236
238	به هر حال نظر من این بود.	Y	هر	48	  114,694	0.1588	47.1429	persian_news_2019_00308080
239	هر چه داشته از دست داده است.	Y	هر	48	  114,694	0.1588	61.5714	persian_news_2019_00865333
240	در هر چهار آغاز شده و پس از آن.	Y	هر	48	  114,694	0.1588	67.3333	persian_news_2019_00489979
241	از 13 استان کشور در این حضور دارند و..	Y	استان	49	  114,028	0.1579	35.625	persian_news_2016_00038219
242	استان با اشاره به اینکه در این..	Y	استان	49	  114,028	0.1579	41	persian_news_2017_00059626
243	در یکی دیگر از استان های کشور.	Y	استان	49	  114,028	0.1579	58.7143	persian_news_2019_00480094
244	و امور استان ادامه داد پیش از این برنامه..	Y	استان	49	  114,028	0.1579	66.4444	persian_news_2017_00921118
245	است معاون امور اجتماعی استان تهران با اشاره به.	Y	استان	49	  114,028	0.1579	77.8889	persian_news_2019_00064848
246	نیز در نظر گرفته شده است از.	Y	نیز	50	  112,998	0.1565	39.8571	persian_news_2019_00837239
247	نیز در این کشور سه میلیون و 670 هزار.	Y	نیز	50	  112,998	0.1565	50.125	persian_news_2019_00837183
248	نیز برنامه خود را به گروه ملی داده و در.	Y	نیز	50	  112,998	0.1565	53.7	persian_news_2019_00837047
249	برخی دیگر نیز در دست انجام است.	Y	نیز	50	  112,998	0.1565	68.1429	persian_news_2019_00241331
250	در سال 2017 صورت گرفته و یکی دیگر نیز.	Y	نیز	50	  112,998	0.1565	72.75	persian_news_2019_00471937
251	استان تهران می باشد گفت در این بیش از..	Y	تهران	51	  112,370	0.1556	48.2222	persian_news_2017_00059677
252	در تهران بررسی می شود و بر اساس.	Y	تهران	51	  112,370	0.1556	63.125	persian_news_2019_00457036
253	های استان تهران در این مراسم با اشاره.	Y	تهران	51	  112,370	0.1556	72.375	persian_news_2019_00856924
254	در شورای شهر تهران بررسی می شود؛	Y	تهران	51	  112,370	0.1556	74.4286	persian_news_2019_00475261
255	همچنین در این ماه در استان تهران از نظر تعداد ۹۰.	Y	تهران	51	  112,370	0.1556	76.3333	persian_news_2019_00876839
256	از 20 درصد آنها شده اند که می..	Y	آنها	52	  112,053	0.1552	38	persian_news_2016_00038276
257	با هم برای ما و هم برای آنها مهم..	Y	آنها	52	  112,053	0.1552	54.5714	persian_news_2017_00258630
258	آنها در ماه می سال گذشته بازداشت شده اند.	Y	آنها	52	  112,053	0.1552	69.8889	persian_news_2016_00169214
259	با به آنها آموزش داده شد وزیر آموزش.	Y	آنها	52	  112,053	0.1552	73.4286	persian_news_2019_00199600
260	ها بودند و آنها را هدف قرار.	Y	آنها	52	  112,053	0.1552	75.7143	persian_news_2019_00857517
261	رئیس سازمان برنامه و گفت این سازمان به همه.	Y	سازمان	53	  111,906	0.155	47.375	persian_news_2019_00545911
262	های ملی سازمان گفت بعد از سه سال.	Y	سازمان	53	  111,906	0.155	57.25	persian_news_2019_00860942
263	چرا که از سازمان در نظر گرفته شده بود.	Y	سازمان	53	  111,906	0.155	60.4444	persian_news_2019_00384063
264	۱۳۹۸ شد رئیس سازمان برنامه و بودجه در این.	Y	سازمان	53	  111,906	0.155	75	persian_news_2019_00001047
265	سازمان توجه به خانواده ها است وی با بیان.	Y	سازمان	53	  111,906	0.155	78.4444	persian_news_2019_00565539
266	اعلام می شود » پس از آن بود که.	Y	اعلام	54	  108,691	0.1505	56.8889	persian_news_2019_00076423
267	کرد و خبر اعلام وی نیز پس از پایان..	Y	اعلام	54	  108,691	0.1505	59.6667	persian_news_2017_00723452
268	رئیس شورای اسلامی اعلام شده و هدف از این..	Y	اعلام	54	  108,691	0.1505	64.6667	persian_news_2017_00599864
269	و ملت را از جمهوری اسلامی ایران اعلام می.	Y	اعلام	54	  108,691	0.1505	66.5556	persian_news_2019_00988503
270	اعلام کرده اند و این در حالی است.	Y	اعلام	54	  108,691	0.1505	66.875	persian_news_2019_00076387
271	این کشور وجود داشته باشد وی افزود.	Y	باشد	55	  106,219	0.1471	47.7143	persian_news_2019_00152604
272	و يا در مجلس حضور داشته باشد.	Y	باشد	55	  106,219	0.1471	55.1429	persian_news_2017_00975836
273	به نظر من هم باید قانون باشد.	Y	باشد	55	  106,219	0.1471	66.5714	persian_news_2019_00305838
274	ی که می شود هم با برنامه باشد و هم..	Y	باشد	55	  106,219	0.1471	73.2222	persian_news_2017_00732476
275	پس اگر قرار باشد مردم عمل کنند، آنها می بايد برای حق خود عمل کنند.	Y	باشد	55	  106,219	0.1471	81.2308	persian_news_2017_00377955
276	است این 5 سال قبل از این دولت هزار.	Y	هزار	56	  105,638	0.1463	55.8571	persian_news_2019_00059019
277	امروز بیش از 716 هزار انجام شده است گفت.	Y	هزار	56	  105,638	0.1463	61.125	persian_news_2019_00119044
278	خواهد داشت گفت در حال حاضر ۷۰۰ هزار.	Y	هزار	56	  105,638	0.1463	66.8571	persian_news_2019_00417729
279	یک ۷۴۰ هزار تومان است وی با بیان اینکه.	Y	هزار	56	  105,638	0.1463	73.875	persian_news_2019_00684799
280	در تا 50 هزار تن انجام شده است معاون.	Y	هزار	56	  105,638	0.1463	74.5	persian_news_2019_00455974
281	از آغاز می شود و تا پایان سال ادامه.	Y	ادامه	57	  105,061	0.1455	57.7778	persian_news_2019_00041839
282	در سال 97 در ادامه به وزارت امور.	Y	ادامه	57	  105,061	0.1455	60	persian_news_2019_00472184
283	آب در شهر که در حال انجام است ادامه.	Y	ادامه	57	  105,061	0.1455	65.625	persian_news_2019_00017763
284	ادامه خواهد داد این در حالی است.	Y	ادامه	57	  105,061	0.1455	68.8571	persian_news_2019_00029119
285	شرکت کنند در ادامه با بیان اینکه.	Y	ادامه	57	  105,061	0.1455	71.5714	persian_news_2019_00609156
286	شورای اسلامی شهر با اشاره به این که در.	Y	اسلامی	58	  102,692	0.1422	43.4444	persian_news_2019_00619120
287	در مجلس شورای اسلامی با اشاره به.	Y	اسلامی	58	  102,692	0.1422	46.5714	persian_news_2019_00483826
288	حال، جمهوری اسلامی هم جمهوری اسلامی است.	Y	اسلامی	58	  102,692	0.1422	49.2	persian_news_2017_00445822
289	کشور بود وی همچنین به انتخابات شورای اسلامی شهر و..	Y	اسلامی	58	  102,692	0.1422	55.1	persian_news_2017_00726533
290	یا پیش از این رئیس مجلس شورای اسلامی.	Y	اسلامی	58	  102,692	0.1422	83.875	persian_news_2019_00019420
291	در مجلس تا پایان سال 97 این طرح.	Y	مجلس	59	  101,845	0.141	61.5714	persian_news_2019_00483795
292	برنامه کشور را به مجلس ارائه دهد گفت در..	Y	مجلس	59	  101,845	0.141	66	persian_news_2016_00286667
293	در مجلس شورای اسلامی در این خصوص می.	Y	مجلس	59	  101,845	0.141	70	persian_news_2019_00483835
294	نماینده مردم در مجلس شورای اسلامی هم گفت برای.	Y	مجلس	59	  101,845	0.141	76.3333	persian_news_2019_00850033
295	در مجلس شورای در این مراسم با اشاره به..	Y	مجلس	59	  101,845	0.141	78	persian_news_2017_00543107
296	ملی این کشور افزود ما در خصوص طرح.	Y	افزود	60	  101,186	0.1401	70.375	persian_news_2019_00811602
297	شده است بررسی شد در این خصوص افزود.	Y	افزود	60	  101,186	0.1401	70.5	persian_news_2019_00605832
298	افزود در حالی که سال های گذشته.	Y	افزود	60	  101,186	0.1401	71.4286	persian_news_2019_00079625
299	به ملی شد وی افزود در سال های پیش.	Y	افزود	60	  101,186	0.1401	72.4	persian_news_2019_00303390
300	آب خواهد شد افزود در این سال حدود دو میلیون..	Y	افزود	60	  101,186	0.1401	73	persian_news_2017_00017544
301	آغاز شده است که پس از طی.	Y	پس	61	   98,909	0.137	69.7143	persian_news_2019_00076805
302	پس از انقلاب تا به امروز در کشور ۵ برنامه توسعه اجرا شده است.	Y	پس	61	   98,909	0.137	77.6923	persian_news_2019_00322433
303	وی پس از يک هفته آزاد شد.	Y	پس	61	   98,909	0.137	78.8571	persian_news_2016_00933843
304	اکنون پس از ۲۸ سال دو انتخابات در پیش است.	Y	پس	61	   98,909	0.137	79.5556	persian_news_2019_00086250
305	قرار گرفته بودند آزاد شد او پس از.	Y	پس	61	   98,909	0.137	81	persian_news_2019_00676768
306	در انقلاب سال ۵۷ نيز جنبش بود که اين کار را انجام داد.	Y	نيز	62	   97,636	0.1352	74	persian_news_2019_00443434
307	اظهار داشت: قانون راه آن را نيز مشخص کرده است.	Y	نيز	62	   97,636	0.1352	96.9	persian_news_2017_00070757
308	خود «ايران امروز» نيز حزب و گروه نيست.	Y	نيز	62	   97,636	0.1352	102	persian_news_2017_00473720
309	وی سال ۸۸ نيز چند هفته بازداشت بود.	Y	نيز	62	   97,636	0.1352	104.1429	persian_news_2017_00954829
310	وی همچنين در ايران با بانک جهانی نيز همکاری داشته است.	Y	نيز	62	   97,636	0.1352	111.1818	persian_news_2017_00973519
311	است وی با اشاره به اینکه به عنوان.	Y	عنوان	63	   96,697	0.1339	46.1429	persian_news_2019_00065067
312	که در آن تاکید داشت را به عنوان یک..	Y	عنوان	63	   96,697	0.1339	51	persian_news_2017_00731934
313	این موضوع است البته که از آن با عنوان.	Y	عنوان	63	   96,697	0.1339	52	persian_news_2019_00160164
314	از آن بود وی عنوان کرد  های سال گذشته.	Y	عنوان	63	   96,697	0.1339	56.1	persian_news_2019_00042188
315	در عنوان کرد که در این خصوص باید.	Y	عنوان	63	   96,697	0.1339	59.8571	persian_news_2019_00477974
316	هستند و در دولت این تلاش ها به طور.	Y	هستند	64	   96,054	0.133	69.7778	persian_news_2019_00868299
317	هستند او گفت مردم و به خصوص شهرستان.	Y	هستند	64	   96,054	0.133	74.5	persian_news_2019_00868149
318	این طرح هستند با بیان اینکه این طرح..	Y	هستند	64	   96,054	0.133	76.1667	persian_news_2017_00155918
319	آن ها از جمله این حمله هستند به گزارش..	Y	هستند	64	   96,054	0.133	85.7778	persian_news_2016_00167143
320	استان هم اکنون در حال اجرای هستند که..	Y	هستند	64	   96,054	0.133	96	persian_news_2017_00060970
321	می کنند و در سه سال گذشته تمام های..	Y	گذشته	65	   95,239	0.1319	53.7778	persian_news_2016_00814861
322	هفته گذشته به این منطقه انجام می شود.	Y	گذشته	65	   95,239	0.1319	60.5	persian_news_2017_00876532
323	۵ درصد بیش از یک سال گذشته است.	Y	گذشته	65	   95,239	0.1319	63.2857	persian_news_2019_00008496
324	ساعت گذشته در استان را به این..	Y	گذشته	65	   95,239	0.1319	66.2857	persian_news_2017_00616702
325	منابع است که در چند سال گذشته این طرح..	Y	گذشته	65	   95,239	0.1319	68.7778	persian_news_2017_00819260
326	 ای که می کنند این است که.	Y	کنند	66	   94,981	0.1315	69.4286	persian_news_2019_00013806
327	شرکت کنند این در حالی است که «	Y	کنند	66	   94,981	0.1315	70.8571	persian_news_2019_00609155
328	کنند وی گفت در این مسابقات 4 از..	Y	کنند	66	   94,981	0.1315	71	persian_news_2017_00731241
329	و همه از آن حمایت می کنند.	Y	کنند	66	   94,981	0.1315	77.5714	persian_news_2016_00977121
330	چرا مردم باید در انتخابات شرکت کنند؟	Y	کنند	66	   94,981	0.1315	83	persian_news_2016_00428742
331	وجود ۸۰۰ گروه در استان گفت « از این.	Y	وجود	67	   92,087	0.1275	43	persian_news_2019_00952804
332	های بخش وجود داشت صورت گرفت وی گفت با.	Y	وجود	67	   92,087	0.1275	63.1111	persian_news_2019_00857279
333	هم اکنون 600 در این استان وجود دارد که.	Y	وجود	67	   92,087	0.1275	66.625	persian_news_2019_00870824
334	گفته است: «به نظر شما وجود دارد؟	Y	وجود	67	   92,087	0.1275	66.8571	persian_news_2016_00743867
335	جامعه از اجرای طرح وجود دارد که مردم.	Y	وجود	67	   92,087	0.1275	70.5	persian_news_2019_00370710
336	اين بخش حدود يک سال است که در وزارت خارجه ايجاد شده است.	Y	يک	68	   91,953	0.1273	100.3333	persian_news_2016_00204813
337	يک ايران آزاد بايد هدف ما باشد.	Y	يک	68	   91,953	0.1273	103	persian_news_2019_00998807
338	اين انتخابات يک آغاز جديد براي ايران و جهان است.	Y	يک	68	   91,953	0.1273	107.1	persian_news_2017_00206486
339	يک روی آن‌ها در مجلس است و روی ديگر آن‌ها در دولت.	Y	يک	68	   91,953	0.1273	112	persian_news_2017_00998162
340	انتخابات هر چهار سال يک بار برگزار می‌شود.	Y	يک	68	   91,953	0.1273	113.625	persian_news_2019_00131384
341	وزیر کشور در گذشته ۳میلیون در کشور وجود داشت.	Y	داشت	69	   90,819	0.1258	72.4286	persian_news_2019_00972265
342	داشت و یک میلیارد دلار را به صورت.	Y	داشت	69	   90,819	0.1258	73.375	persian_news_2019_00423935
343	داشت در آن مراسم عنوان کرد که «.	Y	داشت	69	   90,819	0.1258	73.5714	persian_news_2019_00423640
344	ها در کشور های جهان خواهد داشت وی ادامه.	Y	داشت	69	   90,819	0.1258	74.6	persian_news_2019_00858649
345	تهران در پاسخ به او بیان داشت «	Y	داشت	69	   90,819	0.1258	79.8571	persian_news_2019_00364063
346	در این مدت در های استان انجام شد و با..	Y	انجام	70	   90,711	0.1256	51.5556	persian_news_2017_00495676
347	را در این کشور انجام می دهند که این.	Y	انجام	70	   90,711	0.1256	58.75	persian_news_2019_00514275
348	اين طرح در مدت 5 سال انجام شده است.	Y	انجام	70	   90,711	0.1256	62.625	persian_news_2016_00220354
349	منطقه صورت گرفته در حال انجام است.	Y	انجام	70	   90,711	0.1256	68.2857	persian_news_2017_00825331
350	در بخش دولتی هم انجام شود و این کار.	Y	انجام	70	   90,711	0.1256	76.3333	persian_news_2019_00451649
351	انتخابات آزاد یکی از این حقوق است.	Y	انتخابات	71	   90,191	0.1249	82.7143	persian_news_2017_00141012
352	بیش از ۲۴ میلیون نفر در این انتخابات شرکت کردند.	Y	انتخابات	71	   90,191	0.1249	86.5556	persian_news_2019_00250703
353	های انتخابات ی است افزود در 19 شهر استان تهران..	Y	انتخابات	71	   90,191	0.1249	86.6667	persian_news_2017_00865378
354	این انتخابات سال آینده برگزار خواهد شد.	Y	انتخابات	71	   90,191	0.1249	86.7143	persian_news_2017_00138007
355	قرار است امروز جمعه انتخابات مجلس شورای اسلامی در ایران برگزار شود.	Y	انتخابات	71	   90,191	0.1249	87.1667	persian_news_2016_00706110
356	وی با بیان این که در حال حاضر ۹۹.	Y	حال	72	   90,077	0.1247	61.5	persian_news_2019_00941505
357	تا به حال که چنين بوده است.	Y	حال	72	   90,077	0.1247	72.7143	persian_news_2016_00386409
358	آمریکا گفته بود که در حال حاضر از.	Y	حال	72	   90,077	0.1247	75.75	persian_news_2019_00118208
359	کشور با بیان اینکه در حال حاضر 30 هزار.	Y	حال	72	   90,077	0.1247	81.75	persian_news_2019_00703025
360	ها انجام می شود با بیان اینکه در حال.	Y	حال	72	   90,077	0.1247	82	persian_news_2019_00857127
361	کار استفاده از گفت در این طرح با..	Y	کار	73	   90,015	0.1247	39.625	persian_news_2016_00715736
362	شورای اسلامی شهر برگزار می شود آغاز به کار.	Y	کار	73	   90,015	0.1247	72.8889	persian_news_2019_00619121
363	جهت به کار گرفته شود که در این.	Y	کار	73	   90,015	0.1247	75.75	persian_news_2019_00380486
364	به نظر من باید بر روی این موضوع کار کرد.	Y	کار	73	   90,015	0.1247	77	persian_news_2019_00305693
365	عمل در همه حوزه ها کار را یک سال.	Y	کار	73	   90,015	0.1247	78.1111	persian_news_2019_00650192
366	که در این ماه در برگزار می‌شود، ارائه شود.	Y	می‌شود	74	   89,756	0.1243	65	persian_news_2017_00731957
367	این نشست هر دو سال یک بار برگزار می‌شود.	Y	می‌شود	74	   89,756	0.1243	91.1111	persian_news_2017_00166076
368	روز جمعه و در 25 استان کشور برگزار می‌شود؛	Y	می‌شود	74	   89,756	0.1243	94.125	persian_news_2019_00533046
369	انتخابات سال ۹۸ با قانون جدید برگزار می‌شود؟	Y	می‌شود	74	   89,756	0.1243	99.8571	persian_news_2019_00131206
370	مرحله دوم انتخابات در ۲۱ استان کشور برگزار می‌شود.	Y	می‌شود	74	   89,756	0.1243	112.5	persian_news_2019_00778177
371	اگر چنين شود که در اين گفته اشاره شد.	Y	اگر	75	   89,596	0.1241	70.4444	persian_news_2017_00090144
372	و نیز اشاره می کند و اگر به تمام.	Y	اگر	75	   89,596	0.1241	86.4444	persian_news_2019_00989075
373	کرده اند اگر خانواده های این افراد.	Y	اگر	75	   89,596	0.1241	103.1429	persian_news_2019_00697923
374	اگر هم مانند آمریکا 59 درصد شرکت کنند، چه خواهد شد؟	Y	اگر	75	   89,596	0.1241	104	persian_news_2016_00098399
375	با اشاره به اینکه اگر روزنامه ها و رسانه.	Y	اگر	75	   89,596	0.1241	116.4444	persian_news_2019_00193831
376	در کشور ما هم به همين صورت است.	Y	صورت	76	   87,599	0.1213	49.125	persian_news_2016_00533816
377	در اين جامعه انقلاب صورت گرفته است.	Y	صورت	76	   87,599	0.1213	66.5714	persian_news_2017_00499662
378	در اين دوره هم به همين صورت بود.	Y	صورت	76	   87,599	0.1213	68.625	persian_news_2017_00500865
379	اين عمل در تهران صورت گرفته است.	Y	صورت	76	   87,599	0.1213	76.8571	persian_news_2017_00223306
380	این دو و فعالیت های صورت گرفته به گفت.	Y	صورت	76	   87,599	0.1213	82.2222	persian_news_2019_00142156
381	وی با اشاره به اینکه این از ماه های..	Y	ماه	77	   86,285	0.1195	40.5556	persian_news_2017_00923313
382	با این عنوان این است که چون این ماه..	Y	ماه	77	   86,285	0.1195	70.5714	persian_news_2016_00238248
383	که سفر خود را از 2ماه پیش..	Y	ماه	77	   86,285	0.1195	76.1429	persian_news_2016_00731860
384	این سفر در دو- سه ماه آینده انجام خواهد شد.	Y	ماه	77	   86,285	0.1195	94.2	persian_news_2017_00154163
385	انتخابات قرار است ماه آینده برگزار شود.	Y	ماه	77	   86,285	0.1195	94.4286	persian_news_2019_00131270
386	شد وی گفت شرکت آب منطقه ای استان ها.	Y	ای	78	   85,975	0.1191	71.4444	persian_news_2019_00606336
