ORDER	SENTENCE	STATUS	WORD	RANK	COUNT	COUNT_REL	INDEX	ID
756	ادامه داد این گروه ها تا پایان.	Y	گروه	151	   49,587	0.0687	105.75	persian_news_2019_00029141
757	تهران گذشته از این گروه از  های دولتی که.	Y	گروه	151	   49,587	0.0687	111.1111	persian_news_2019_00364215
758	گروه های ی بر اساس آن حضور داشته باشند و..	Y	گروه	151	   49,587	0.0687	118.9	persian_news_2017_00737620
759	وی همچنین از شرکت سه گروه آزاد در این نمایشگاه خبر داد.	Y	گروه	151	   49,587	0.0687	125.5	persian_news_2016_00974733
760	جمهوری اسلامی ایران به عنوان رئیس جدید گروه ۷۷ سازمان ملل انتخاب شد.	Y	گروه	151	   49,587	0.0687	126.5833	persian_news_2019_00378014
761	مربوط به این هم تولید شده است وی در.	Y	تولید	152	   49,374	0.0684	64.2222	persian_news_2019_00777490
762	تن هم در استان تولید شد که این..	Y	تولید	152	   49,374	0.0684	65.625	persian_news_2017_00410080
763	از 550 هزار تن در استان تولید شود..	Y	تولید	152	   49,374	0.0684	79.4286	persian_news_2017_00037485
764	کنیم وی با اشاره به اینکه تولید این در..	Y	تولید	152	   49,374	0.0684	82.3333	persian_news_2017_00731157
765	در کشور بیش از 420هزار تن تولید می شود..	Y	تولید	152	   49,374	0.0684	86.4444	persian_news_2017_00539747
766	دو میلیون و ٢٦٥ هزار از این میزان را..	Y	میلیون	153	   49,323	0.0683	79.875	persian_news_2017_00572187
767	۶ میلیون نفر است که باید بیشتر هم شده باشد.	Y	میلیون	153	   49,323	0.0683	86.3333	persian_news_2016_00011330
768	تومان و امام هم یک میلیون و ۲۳1 هزار..	Y	میلیون	153	   49,323	0.0683	97.1429	persian_news_2017_00414004
769	آغاز می شود در این مرحله ۱۱ میلیون نفر.	Y	میلیون	153	   49,323	0.0683	102.375	persian_news_2019_00076932
770	گفت تاکنون یک میلیون و ۱۵۰ هزار نفر برای.	Y	میلیون	153	   49,323	0.0683	103.5	persian_news_2019_00723978
771	بار است که توسط این کشور مطرح می شود.	Y	توسط	154	   48,785	0.0676	73.2222	persian_news_2016_00247387
772	مطرح شده توسط دولت حدود ۲۸ هزار نفر از.	Y	توسط	154	   48,785	0.0676	96.875	persian_news_2019_00793450
773	توسعه کسب و کار و تولید توسط را انجام داده و برای طرح در جلسه شورای.	Y	توسط	154	   48,785	0.0676	111.4286	persian_news_2019_00366338
774	 ای توسط ایران به ۶۵۰ میلیون تن در سال.	Y	توسط	154	   48,785	0.0676	112.7778	persian_news_2019_00013759
775	مدت 6 ماه توسط وزارت کشور و با همکاری..	Y	توسط	154	   48,785	0.0676	120	persian_news_2017_00784596
776	در جشنواره بودند که از آنها 12 کشور با..	Y	بودند	155	   48,518	0.0672	79.75	persian_news_2017_00514705
777	به او گفته بودند كه آزاد مى شود.	Y	بودند	155	   48,518	0.0672	96.625	persian_news_2016_00307756
778	در این مسابقات بیش از 7 هزار نفر شرکت کرده بودند.	Y	بودند	155	   48,518	0.0672	105.7	persian_news_2017_00496063
779	۳۲ حزب مختلف در این انتخابات شرکت کرده بودند.	Y	بودند	155	   48,518	0.0672	109.625	persian_news_2017_00006005
780	«از آنها چهار نفر بودند، از ما سه نفر.	Y	بودند	155	   48,518	0.0672	109.8571	persian_news_2016_00041701
781	شدند در حال حاضر در این حوزه ۹۸.	Y	شدند	156	   48,414	0.067	102.1667	persian_news_2019_00605617
782	ایران برای حضور در سال 2019 معرفی شدند که.	Y	شدند	156	   48,414	0.067	104.75	persian_news_2019_00032882
783	آنها نیز شدند وی با بیان اینکه فرهنگ.	Y	شدند	156	   48,414	0.067	105	persian_news_2019_00165070
784	شدند در خارج از کشور حدود 900 میلیون تا..	Y	شدند	156	   48,414	0.067	107	persian_news_2016_00644845
785	از نمایندگان دو انتخاب شدند تا در یک ماه..	Y	شدند	156	   48,414	0.067	115.7778	persian_news_2016_00056480
786	این کار برای این کشور خوب است، برای آنها خوب است، برای ما خوب است و برای جهان خوب است.	Y	جهان	157	   48,218	0.0668	93.9	persian_news_2019_00151106
787	٢ درصد از مردم جهان را در خود جای داده است.	Y	جهان	157	   48,218	0.0668	95.2	persian_news_2017_00004759
788	ی جهان را از آن خود کرد در این مسابقات.	Y	جهان	157	   48,218	0.0668	100.7	persian_news_2019_00379971
789	جهان در آن زمان از آن حمایت کرد و اکنون هم از آن حمایت می‌کند.	Y	جهان	157	   48,218	0.0668	114.1818	persian_news_2019_00379954
790	در این دوره 4500 نماینده از کشورهای مختلف جهان برگزار شد.	Y	جهان	157	   48,218	0.0668	128.5	persian_news_2017_00492306
791	البته نه اين بود و نه آن.	Y	نه	158	   47,679	0.066	69.5	persian_news_2017_00104325
792	، که او در پاسخ گفت: « نه، نه.	Y	نه	158	   47,679	0.066	76.1667	persian_news_2017_00731556
793	این هفته نه بازی در انجام شد.	Y	نه	158	   47,679	0.066	93	persian_news_2019_00165677
794	آمده بود نه آن زمان در یکی از.	Y	نه	158	   47,679	0.066	114.625	persian_news_2019_00116210
795	اين مشکل خود نظام است نه ما!	Y	نه	158	   47,679	0.066	122.2857	persian_news_2016_00228903
796	اظهار داشت 117 مورد از این تعداد به.	Y	اظهار	159	   47,539	0.0658	81.7143	persian_news_2019_00074062
797	و اظهار داشت امسال سازمان نیز به عنوان سازمان.	Y	اظهار	159	   47,539	0.0658	84.5	persian_news_2019_00921758
798	هفته های گذشته تهران اظهار کرد در این.	Y	اظهار	159	   47,539	0.0658	87.8889	persian_news_2019_00869199
799	اظهار کرده اند که در این انتخابات برای آنان.	Y	اظهار	159	   47,539	0.0658	102.9	persian_news_2019_00074304
800	در استان معرفی کرد و اظهار داشت.	Y	اظهار	159	   47,539	0.0658	118	persian_news_2019_00435236
801	دوره انتخابات سازمان نظام در این شهرستان خبر داد.	Y	نظام	160	   47,168	0.0653	89.1111	persian_news_2019_00505938
802	که این حق بر اطلاعات و نظام است که.	Y	نظام	160	   47,168	0.0653	89.625	persian_news_2019_00712229
803	است و دولت و نظام ی اسلامی ایران شما را.	Y	نظام	160	   47,168	0.0653	98.2222	persian_news_2019_00065166
804	 نظام  جمهوری  ایران  را به.	Y	نظام	160	   47,168	0.0653	98.8333	persian_news_2019_00014027
805	تولید می شود با نظام ی است وی با بیان..	Y	نظام	160	   47,168	0.0653	107.6667	persian_news_2016_00410396
806	وی در پایان با از تلاش های معاون فرهنگی..	Y	معاون	161	   46,627	0.0646	93.4444	persian_news_2017_00943757
807	در حال است معاون امور مجلس دانشگاه آزاد اسلامی..	Y	معاون	161	   46,627	0.0646	96.1111	persian_news_2016_00511258
808	در نامه ای به معاون وزیر کشور از.	Y	معاون	161	   46,627	0.0646	101.125	persian_news_2019_00487491
809	باشد معاون امور اقتصادی و توسعه منابع نسبت به سال قبل از آن ۲۸ درصد.	Y	معاون	161	   46,627	0.0646	103.3571	persian_news_2019_00211225
810	استان با حضور معاون اول رئیس جمهور در حال.	Y	معاون	161	   46,627	0.0646	105.8889	persian_news_2019_00059235
811	است با بیان اینکه در این طرح دولت مرکز.	Y	بیان	162	   45,825	0.0635	81.2222	persian_news_2019_00062031
812	را دارد عضو دولت با بیان اینکه با وجود.	Y	بیان	162	   45,825	0.0635	81.625	persian_news_2019_00514157
813	امسال را نیز کنند وی با بیان اینکه سازمان..	Y	بیان	162	   45,825	0.0635	86.1111	persian_news_2016_00133305
814	وی گفت: مهم این است که هر آنچه وجود دارد برای مردم بیان شود.	Y	بیان	162	   45,825	0.0635	88	persian_news_2016_00967386
815	بانک ایران نیز با بیان اینکه این.	Y	بیان	162	   45,825	0.0635	89	persian_news_2019_00215867
816	خواهد بود وزیر امور خارجه را در سفر به.	Y	امور	163	   45,724	0.0633	100.6667	persian_news_2019_00417715
817	رئیس سازمان امور اجتماعی کشور مطرح کرد؛	Y	امور	163	   45,724	0.0633	107.1429	persian_news_2019_00545457
818	و امور مجلس وزیر خارجه با بیان..	Y	امور	163	   45,724	0.0633	114.4286	persian_news_2017_00921120
819	وی ادامه داد: وزارت امور خارجه آن چه را که در توان داشته انجام داده و اقدامات لازم را انجام خواهد داد.	Y	امور	163	   45,724	0.0633	114.9474	persian_news_2016_00901426
820	نفر از اعضای این و وزارت امور خارجه در.	Y	امور	163	   45,724	0.0633	115.2222	persian_news_2019_00842117
821	این است که این در هفته های آینده..	Y	هفته	164	   45,704	0.0633	75.4286	persian_news_2016_00136662
822	که در هفته های آینده پرداخت می شود.	Y	هفته	164	   45,704	0.0633	96.875	persian_news_2016_00731736
823	هفته وارد استان شده و با حضور مسئولان از..	Y	هفته	164	   45,704	0.0633	98.4444	persian_news_2016_00873457
824	قرار است هفته آینده با حضور وزیر راه..	Y	هفته	164	   45,704	0.0633	107	persian_news_2017_00706147
825	در سال 2017 در طول یک هفته که برای.	Y	هفته	164	   45,704	0.0633	107.4286	persian_news_2019_00471932
826	و قرار می دهد و در سال ۲۰۱۸.	Y	دهد	165	   45,643	0.0632	78.4286	persian_news_2019_00979470
827	را در بر گرفت و اکنون در سال ۹۱ هم به روند خود با قدرت ادامه می دهد.	Y	دهد	165	   45,643	0.0632	91.9375	persian_news_2016_00572167
828	وی در ادامه به فعاليت بانک خود که از ۳۰ سال پيش تا به امروز به کار خود ادامه می دهد اشاره کرد.	Y	دهد	165	   45,643	0.0632	92.1667	persian_news_2016_00943028
829	آنچه ها نشان می دهد این است که در این.	Y	دهد	165	   45,643	0.0632	99.7778	persian_news_2019_00136624
830	زنان را نشان می دهد وی ادامه داد.	Y	دهد	165	   45,643	0.0632	101	persian_news_2019_00559556
831	ادامه داد باید پیش از گذشته در سطح.	Y	پیش	166	   45,400	0.0629	87	persian_news_2019_00029147
832	کنند البته هم که در بازی پیش و..	Y	پیش	166	   45,400	0.0629	88.5	persian_news_2016_00730867
833	با اشاره به در پیش بودن روز.	Y	پیش	166	   45,400	0.0629	102.5714	persian_news_2019_00193939
834	در مورد اینکه این تیم 2 سال پیش شرایط..	Y	پیش	166	   45,400	0.0629	105.875	persian_news_2017_00546208
835	توسعه بیش از پیش منطقه کشور را به همراه.	Y	پیش	166	   45,400	0.0629	106	persian_news_2019_00366205
836	و تا پایان اول سال 98 پایان می.	Y	اول	167	   45,351	0.0628	75.3333	persian_news_2019_00948095
837	اول یک دیدار برگزار شد که در آن.	Y	اول	167	   45,351	0.0628	85.5	persian_news_2019_00179172
838	از اول هم اساس بر همين بود.	Y	اول	167	   45,351	0.0628	91.2857	persian_news_2016_00041951
839	از اول باید همین کار را می کردند.	Y	اول	167	   45,351	0.0628	97.5	persian_news_2019_00044404
840	اما در هر صورت انتخابات مرحله اول برگزار شد.	Y	اول	167	   45,351	0.0628	99.4444	persian_news_2017_00119313
841	شبکه های اجتماعی برگزار می شود این در بخش..	Y	اجتماعی	168	   45,227	0.0626	100.8889	persian_news_2017_00644573
842	ما انجام می شود و فرهنگ اجتماعی مورد.	Y	اجتماعی	168	   45,227	0.0626	103	persian_news_2019_00736176
843	های اجتماعی خارجی در ایران می پرداخت با بیان..	Y	اجتماعی	168	   45,227	0.0626	103.3333	persian_news_2017_00865275
844	در حوزه های اجتماعی و کشور شاهد باشد به.	Y	اجتماعی	168	   45,227	0.0626	103.6667	persian_news_2019_00465113
845	معاون فرهنگی و اجتماعی دانشگاه عنوان کرد؛	Y	اجتماعی	168	   45,227	0.0626	106	persian_news_2019_00801650
846	از 9 ماه گذشته در این حوزه تشکیل شده است.	Y	حوزه	169	   45,215	0.0626	98.3333	persian_news_2016_00038416
847	حوزه های و بخش های مختلف کشور ایجاد شده.	Y	حوزه	169	   45,215	0.0626	98.625	persian_news_2019_00407204
848	و مردم در حوزه های خود برخورد کردند و..	Y	حوزه	169	   45,215	0.0626	103.5	persian_news_2017_00969861
849	ما در حوزه اجتماعی 50 هزار واحد است که.	Y	حوزه	169	   45,215	0.0626	106.625	persian_news_2019_00738749
850	است تا فرهنگ در حوزه های جدید و مورد.	Y	حوزه	169	   45,215	0.0626	111.2	persian_news_2019_00062214
851	بحث ما این است که این دولت ندارد.	Y	ندارد	170	   44,299	0.0614	85.7143	persian_news_2019_00221501
852	ندارد ‎ ‎ با اشاره به اینکه بیش از سه.	Y	ندارد	170	   44,299	0.0614	92	persian_news_2019_00835173
853	وجود ندارد با بیان اینکه هم اکنون در کشور..	Y	ندارد	170	   44,299	0.0614	102.8889	persian_news_2017_00938049
854	انتخابات را ندارد نظارت بر انتخابات در این..	Y	ندارد	170	   44,299	0.0614	103.4286	persian_news_2017_00141426
855	رشد اقتصادی در این منطقه وجود ندارد.	Y	ندارد	170	   44,299	0.0614	105.2857	persian_news_2017_00584295
856	اين انتخاب از پيش انجام شده بود.	Y	پيش	171	   44,234	0.0613	82	persian_news_2016_00203464
857	اين در حالی است که پيش از اين، قرار بود پرداخت ها هر هفت سال يک بار انجام شود.	Y	پيش	171	   44,234	0.0613	118.1111	persian_news_2016_00212000
858	اين مذاکرات از سه سال پيش آغاز شد.	Y	پيش	171	   44,234	0.0613	129.75	persian_news_2017_00229939
859	اين بار نيز پيش از انتخاب مردم، شورای نگهبان انتخاب خود را کرده است.	Y	پيش	171	   44,234	0.0613	132.3077	persian_news_2016_00204219
860	اين سياست ها از مدت ها پيش آغاز شده است.»	Y	پيش	171	   44,234	0.0613	134.2222	persian_news_2016_00219195
861	از سوی سازمان برنامه و بودجه انجام شد؛	Y	سوی	172	   44,204	0.0612	92.25	persian_news_2019_00051421
862	از سوی رئیس سازمان برنامه و بودجه انجام شد؛	Y	سوی	172	   44,204	0.0612	92.7778	persian_news_2019_00051415
863	وی اضافه کرد: «از سوی دیگر، باید در نظر داشت سال آینده، سال انتخابات مجلس است.	Y	سوی	172	   44,204	0.0612	95.8667	persian_news_2016_00904901
864	اعلام و جمهوری اسلامی بر اقدام لازم از سوی.	Y	سوی	172	   44,204	0.0612	97.7778	persian_news_2019_00076503
865	از سوی رئیس سازمان برنامه و بودجه؛	Y	سوی	172	   44,204	0.0612	107	persian_news_2019_00051414
866	در استان را 679 میلیارد تومان و در استان..	Y	تومان	173	   44,032	0.061	69.1667	persian_news_2016_00482105
867	۲ میلیارد تومان برای این مهم در نظر گرفته شده بود.	Y	تومان	173	   44,032	0.061	87.3	persian_news_2019_00004725
868	میلیارد تومان برای عمومی در نظر گرفته شد که.	Y	تومان	173	   44,032	0.061	94	persian_news_2019_00811372
869	در سال جاری نیز، ۱۸۲۰ میلیارد تومان تا به حال پرداخت شده است.	Y	تومان	173	   44,032	0.061	94.1667	persian_news_2019_00472329
870	تومان وارد شده بیشتر است و در مورد.	Y	تومان	173	   44,032	0.061	95.25	persian_news_2019_00368134
871	در تاکید شده است بر اساس این.	Y	اساس	174	   43,891	0.0608	68.7143	persian_news_2019_00456229
872	کرد بر اساس برنامه قرار بود را در شرایط..	Y	اساس	174	   43,891	0.0608	80.7778	persian_news_2017_00723154
873	بر اساس آب است گفت در حال حاضر.	Y	اساس	174	   43,891	0.0608	87.75	persian_news_2019_00228416
874	است بر این اساس بودجه اجرای برنامه های که..	Y	اساس	174	   43,891	0.0608	96	persian_news_2017_00061057
875	بر اساس آن باید 50 درصد از فعال در..	Y	اساس	174	   43,891	0.0608	104.375	persian_news_2017_00273263
876	که وارد آزاد یا از آن خارج می شود..	Y	یا	175	   43,433	0.0602	106.1111	persian_news_2017_00732612
877	سال آینده به صورت ملی یا منطقه.	Y	یا	175	   43,433	0.0602	118.4286	persian_news_2019_00569776
878	 ای در مجلس یا دولت طی شود اظهار داشته.	Y	یا	175	   43,433	0.0602	118.5	persian_news_2019_00013767
879	سازمان برنامه و بودجه یا وزارت کار؟	Y	یا	175	   43,433	0.0602	119.5714	persian_news_2019_00565235
880	آن ها به دو برابر یا بیش از دو برابر افزایش یافته است.	Y	یا	175	   43,433	0.0602	137.5455	persian_news_2017_00168258
881	حضور شما به تلاش های ما کمک می کند.	Y	شما	176	   43,385	0.0601	97.5556	persian_news_2019_00403558
882	است تا حق مردم پرداخت شود اما شما.	Y	شما	176	   43,385	0.0601	99.625	persian_news_2019_00062205
883	هدف از سفر شما به تهران چه بود؟	Y	شما	176	   43,385	0.0601	107.625	persian_news_2016_00865915
884	نقش شما در اين مورد چه بوده؟	Y	شما	176	   43,385	0.0601	107.8571	persian_news_2017_00852219
885	مردم در انتخابات پاسخ شما را خواهند داد.	Y	شما	176	   43,385	0.0601	108.25	persian_news_2019_00779482
886	است گفت سال 2016 که پایان آن حدود یک..	Y	حدود	177	   43,262	0.0599	63	persian_news_2017_00062934
887	این است که سال گذشته حدود 5 تن از..	Y	حدود	177	   43,262	0.0599	69.25	persian_news_2016_00136667
888	منابع است وی افزود در این استان حدود.	Y	حدود	177	   43,262	0.0599	75.75	persian_news_2019_00813164
889	از آن مربوط به است وی افزود حدود.	Y	حدود	177	   43,262	0.0599	79.25	persian_news_2019_00044089
890	کنند اعلام کرد حدود 80 درصد خانواده ها در..	Y	حدود	177	   43,262	0.0599	90.875	persian_news_2017_00731174
891	پس هم برنامه مهم است و هم افراد.	Y	افراد	178	   43,249	0.0599	90.5714	persian_news_2019_00325462
892	یکی از افراد بود که همه خانواده او در..	Y	افراد	178	   43,249	0.0599	92	persian_news_2017_00718764
893	دوم آن که برنامه های ما برای تمام افراد خانواده است.	Y	افراد	178	   43,249	0.0599	96.6364	persian_news_2016_00567157
894	دو سال پیش عضو از افراد خارجی در کشور..	Y	افراد	178	   43,249	0.0599	107.3333	persian_news_2016_00563081
895	در این وجود دارد به گونه ای که افراد.	Y	افراد	178	   43,249	0.0599	110	persian_news_2019_00446761
896	آب می شود و از بین می.	Y	بین	179	   43,154	0.0598	105.2857	persian_news_2019_00018622
897	هم است و هم حکومت و بین این دو.	Y	بین	179	   43,154	0.0598	110.1429	persian_news_2019_00870471
898	و در این خصوص بین المللی وجود دارد..	Y	بین	179	   43,154	0.0598	115.375	persian_news_2016_00943898
899	است که با در مسابقات بین المللی شرکت.	Y	بین	179	   43,154	0.0598	130	persian_news_2019_00064432
900	شد که از این بین 171 اثر انتخاب شد.	Y	بین	179	   43,154	0.0598	133	persian_news_2019_00605432
901	پس از آن با روزنامه همشهری ادامه داد.	Y	روزنامه	180	   42,967	0.0595	106.125	persian_news_2016_00372373
902	کرده اند گفت روزنامه همشهری هم با توجه به.	Y	روزنامه	180	   42,967	0.0595	107.8889	persian_news_2019_00697944
903	روزنامه ها به این بخش از گفته های روحانی توجه کردند.	Y	روزنامه	180	   42,967	0.0595	109.5455	persian_news_2016_00592825
904	ی به عنوان های برخی روزنامه ها و خبرگزاری های.	Y	روزنامه	180	   42,967	0.0595	122.7778	persian_news_2019_00275533
905	در اين كشور روزنامه آزاد وجود ندارد.	Y	روزنامه	180	   42,967	0.0595	126.5714	persian_news_2016_00497036
906	از 52 هزار تن در این شهرستان تولید..	Y	شهرستان	181	   42,607	0.059	95.7143	persian_news_2017_00037481
907	این شهرستان با توجه به شرایط خود.	Y	شهرستان	181	   42,607	0.059	95.8571	persian_news_2019_00147020
908	شهرستان و شهر تهران به دست آمده بود مورد.	Y	شهرستان	181	   42,607	0.059	97.8889	persian_news_2019_00617008
909	برای طرح های این شهرستان را ۱۴۲ میلیارد.	Y	شهرستان	181	   42,607	0.059	101.25	persian_news_2019_00234375
910	استان تهران و نمایندگان مردم شهرستان های استان..	Y	شهرستان	181	   42,607	0.059	108.4286	persian_news_2016_00059421
911	برای آنها اين مهم است که تيم موفق شود.	Y	تيم	182	   42,493	0.0588	124.3333	persian_news_2017_00270233
912	فوتبال بازی خط ها نيست، اين يک تيم است که در دفاع و حمله شرکت می‌کند.	Y	تيم	182	   42,493	0.0588	140.625	persian_news_2016_00701310
913	البته او همراه تيم ملی در جام جهانی حضور داشت اما..	Y	تيم	182	   42,493	0.0588	142.8182	persian_news_2016_00100675
914	اين ديدار برای هر دو تيم بسيار مهم است.	Y	تيم	182	   42,493	0.0588	168.5556	persian_news_2017_00217804
915	برای اين که تيم بسيار خوبی بودند.	Y	تيم	182	   42,493	0.0588	171.2857	persian_news_2017_00270478
916	۴ میلیارد دلار در نظر گرفته شده است.	Y	میلیارد	183	   42,452	0.0588	88.5714	persian_news_2016_00008453
917	۷ میلیارد دلار از ایران نفت وارد کرده است.	Y	میلیارد	183	   42,452	0.0588	96.125	persian_news_2016_00012269
918	دو کشور دو میلیارد دلار افزایش می..	Y	میلیارد	183	   42,452	0.0588	98.5	persian_news_2016_00563871
919	شد افزود با برگزاری این ها و کمک 7میلیارد.	Y	میلیارد	183	   42,452	0.0588	102.6667	persian_news_2019_00605044
920	وی با بیان اینکه کشورهای آنها بیش از 30 هزار میلیارد تومان است..	Y	میلیارد	183	   42,452	0.0588	103.8333	persian_news_2017_00927588
921	را در یکی از ها اجرا می کند و در.	Y	یکی	184	   42,091	0.0583	77	persian_news_2019_00514407
922	دو دیدار برگزار شد که در یکی از.	Y	یکی	184	   42,091	0.0583	87	persian_news_2019_00505320
923	خواهد بود در یکی دیگر از بخش های.	Y	یکی	184	   42,091	0.0583	89.5556	persian_news_2019_00417692
924	پرداخت و گفت خانه ایران به عنوان یکی از..	Y	یکی	184	   42,091	0.0583	98.4444	persian_news_2017_00371007
925	کرد و گفت توسعه یکی از پروژه های.	Y	یکی	184	   42,091	0.0583	103.5	persian_news_2019_00698170
926	این است که تا پایان این دوره 30 درصد.	Y	دوره	185	   41,962	0.0581	76.1429	persian_news_2019_00125190
927	این کار در دوره قبل انجام شد.	Y	دوره	185	   41,962	0.0581	87.8571	persian_news_2016_00157881
928	دوره از شنبه آغاز شده است و تا.	Y	دوره	185	   41,962	0.0581	89.625	persian_news_2019_00505899
929	با شبکه خبر گفت در این دوره از.	Y	دوره	185	   41,962	0.0581	97.625	persian_news_2019_00211088
930	کشاورزی از دوره های برگزار شده در استان..	Y	دوره	185	   41,962	0.0581	103	persian_news_2016_00724868
931	های رئیس فوتبال اعلام می کند « در گذشته.	Y	فوتبال	186	   41,814	0.0579	87.7778	persian_news_2019_00859096
932	فوتبال ایران با توجه به در پیش بودن..	Y	فوتبال	186	   41,814	0.0579	114.25	persian_news_2016_00701264
933	سال 2019 سال خوبی برای فوتبال ایران خواهد بود.	Y	فوتبال	186	   41,814	0.0579	117.1429	persian_news_2019_00569413
934	در فوتبال صورت گرفته شود به همین خاطر این.	Y	فوتبال	186	   41,814	0.0579	131.2222	persian_news_2019_00478995
